# Copyright 2015 - 2023 The Cockroach Authors. All rights reserved.
# Copyright Materialize, Inc. and contributors. All rights reserved.
#
# Use of this software is governed by the Business Source License
# included in the LICENSE file at the root of this repository.
#
# As of the Change Date specified in that file, in accordance with
# the Business Source License, use of this software will be governed
# by the Apache License, Version 2.0.
#
# This file is derived from the logic test suite in CockroachDB. The
# original file was retrieved on July 6, 2026 from:
#
#     https://github.com/cockroachdb/cockroach/blob/358e0d87912365b8976c55ab9b3292e999cf720d/pkg/sql/logictest/testdata/logic_test/materialized_view
#
# That commit is tagged v23.1.0. CockroachDB v23.1 is licensed under
# the Business Source License 1.1 with a Change Date of 2026-04-01 and
# a Change License of Apache 2.0, so as of the retrieval date the
# original source code is subject to the terms of the Apache 2.0
# license, a copy of which can be found in the LICENSE file at the
# root of this repository.

mode cockroach

statement ok
CREATE TABLE t (x INT, y INT);
INSERT INTO t VALUES (1, 2), (3, 4), (5, 6)

statement ok
CREATE MATERIALIZED VIEW v AS SELECT x, y FROM t

# Not supported by Materialize.
onlyif cockroach
# Ensure that materialized views show up in SHOW TABLES.
query T
SELECT table_name FROM [SHOW TABLES] WHERE type = 'materialized view'
----
v

query II rowsort
SELECT * FROM v
----
1 2
3 4
5 6

# If we update t, the view shouldn't change.
statement ok
INSERT INTO t VALUES (7, 8)

query II rowsort
SELECT * FROM v
----
1  2
3  4
5  6
7  8

let $orig_crdb_timestamp
SELECT max(crdb_internal_mvcc_timestamp) FROM v

# Not supported by Materialize.
onlyif cockroach
# Now refresh the view.
statement ok
REFRESH MATERIALIZED VIEW v

# The update should be visible now, as v has been recomputed.
query II rowsort
SELECT * FROM v
----
1 2
3 4
5 6
7 8

# Not supported by Materialize.
onlyif cockroach
# Verify that crdb_internal_mvcc_timestamp is updated for all rows.
query I
SELECT count(*) FROM v WHERE crdb_internal_mvcc_timestamp > $orig_crdb_timestamp
----
4

# Now add an index to the view, and use it.
statement ok
CREATE INDEX i ON v (y)

# Not supported by Materialize.
onlyif cockroach
query I rowsort
SELECT y FROM v@i WHERE y > 4
----
6
8

# Now update t and refresh the view -- the index should be updated as well.
statement ok
INSERT INTO t VALUES (9, 10)

# Not supported by Materialize.
onlyif cockroach
statement ok
REFRESH MATERIALIZED VIEW v

query I rowsort
SELECT y FROM v WHERE y > 4
----
6
8
10

# Not supported by Materialize.
onlyif cockroach
# Drop the index now.
statement ok
DROP INDEX v@i

query I rowsort
SELECT y FROM v WHERE y > 4
----
6
8
10

# We can't refresh with an explicit txn.
statement ok
BEGIN

statement error Unexpected keyword REFRESH at the beginning of a statement
REFRESH MATERIALIZED VIEW v

statement ok
ROLLBACK

statement error cannot insert into materialized view 'materialize\.public\.v'
INSERT INTO v VALUES (1, 2)

statement error cannot mutate materialized view 'materialize\.public\.v'
UPDATE v SET x = 1 WHERE y = 1

statement error cannot mutate materialized view 'materialize\.public\.v'
DELETE FROM v WHERE x = 1

statement error Expected a keyword at the beginning of a statement, found identifier "truncate"
TRUNCATE v

# Test that a materialized view with a unique index errors out if the refresh
# runs into a uniqueness constraint violation.
statement ok
CREATE TABLE dup (x INT);

statement ok
CREATE MATERIALIZED VIEW v_dup AS SELECT x FROM dup;

statement ok
CREATE UNIQUE INDEX i ON v_dup (x);

statement ok
INSERT INTO dup VALUES (1), (1);

statement error Unexpected keyword REFRESH at the beginning of a statement
REFRESH MATERIALIZED VIEW v_dup

# We shouldn't be able to mix materialized and non materialized views in DDLs.
statement ok
CREATE VIEW normal_view AS SELECT 1;
CREATE MATERIALIZED VIEW materialized_view AS SELECT 1;

statement error materialized_view is not a view
ALTER VIEW materialized_view RENAME TO newname

statement error normal_view is a view not a materialized view
ALTER MATERIALIZED VIEW normal_view RENAME TO newname

statement error Expected left parenthesis, found SCHEMA
ALTER VIEW materialized_view SET SCHEMA public

statement error Expected left parenthesis, found SCHEMA
ALTER MATERIALIZED VIEW normal_view SET SCHEMA public

statement error materialized_view is not a view
DROP VIEW materialized_view

statement error normal_view is a view not a materialized view
DROP MATERIALIZED VIEW normal_view

# Using REFRESH MATERIALIZED VIEW ... WITH NO DATA should result in
# an empty view.
statement ok
CREATE MATERIALIZED VIEW with_options AS SELECT 1;

# Not supported by Materialize.
onlyif cockroach
statement ok
REFRESH MATERIALIZED VIEW with_options WITH DATA

query I
SELECT * FROM with_options
----
1

# Not supported by Materialize.
onlyif cockroach
statement ok
REFRESH MATERIALIZED VIEW with_options WITH NO DATA

query I
SELECT * FROM with_options
----
1

# Regression test for null data in materialized views.
statement ok
CREATE TABLE t57108 (id INT PRIMARY KEY, a INT);
INSERT INTO t57108 VALUES(1, 1), (2, NULL);
CREATE MATERIALIZED VIEW t57108_v AS SELECT t57108.a from t57108;

query I rowsort
SELECT * FROM t57108_v
----
NULL
1

user testuser

# testuser should not be able to refresh the materialized view without
# ownership.
statement error Unexpected keyword REFRESH at the beginning of a statement
REFRESH MATERIALIZED VIEW with_options WITH NO DATA

user root

# Not supported by Materialize.
onlyif cockroach
statement ok
GRANT root TO testuser

user testuser

# Not supported by Materialize.
onlyif cockroach
# testuser should now be able to refresh the materialized view as a member of
# root.
statement ok
REFRESH MATERIALIZED VIEW with_options WITH NO DATA

# Not supported by Materialize.
onlyif cockroach
statement ok
REVOKE root FROM testuser

user root

# Not supported by Materialize.
onlyif cockroach
statement ok
GRANT CREATE ON DATABASE test TO testuser

# Not supported by Materialize.
onlyif cockroach
statement ok
ALTER MATERIALIZED VIEW with_options OWNER TO testuser

# Not supported by Materialize.
onlyif cockroach
# root should still be able to refresh the view.
statement ok
REFRESH MATERIALIZED VIEW with_options WITH NO DATA

user testuser

# Not supported by Materialize.
onlyif cockroach
# testuser should now be able to refresh the materialized view as the owner.
statement ok
REFRESH MATERIALIZED VIEW with_options WITH NO DATA

# Not supported by Materialize.
onlyif cockroach
# Test CREATE MATERIALIZED VIEW referring to a sequence.
statement ok
CREATE SEQUENCE seq;
CREATE MATERIALIZED VIEW view_from_seq AS (SELECT nextval('seq'))

# Not supported by Materialize.
onlyif cockroach
query I
SELECT * FROM view_from_seq
----
1

# Regression test for #79015.
user testuser

statement ok
BEGIN

user root

# Not supported by Materialize.
onlyif cockroach
statement ok
SELECT * FROM system.descriptor;

user testuser

# Not supported by Materialize.
onlyif cockroach
statement ok
CREATE SEQUENCE seq_2;
CREATE MATERIALIZED VIEW view_from_seq_2 AS (SELECT nextval('seq_2'));
COMMIT
