# Copyright 2015 - 2023 The Cockroach Authors. All rights reserved.
# Copyright Materialize, Inc. and contributors. All rights reserved.
#
# Use of this software is governed by the Business Source License
# included in the LICENSE file at the root of this repository.
#
# As of the Change Date specified in that file, in accordance with
# the Business Source License, use of this software will be governed
# by the Apache License, Version 2.0.
#
# This file is derived from the logic test suite in CockroachDB. The
# original file was retrieved on July 6, 2026 from:
#
#     https://github.com/cockroachdb/cockroach/blob/358e0d87912365b8976c55ab9b3292e999cf720d/pkg/sql/logictest/testdata/logic_test/scale
#
# That commit is tagged v23.1.0. CockroachDB v23.1 is licensed under
# the Business Source License 1.1 with a Change Date of 2026-04-01 and
# a Change License of Apache 2.0, so as of the retrieval date the
# original source code is subject to the terms of the Apache 2.0
# license, a copy of which can be found in the LICENSE file at the
# root of this repository.

mode cockroach

statement ok
CREATE TABLE test (
  t CHAR(4),
  UNIQUE INDEX a (t)
)

statement ok
INSERT INTO test VALUES ('a')

statement ok
INSERT INTO test VALUES ('ab')

statement ok
INSERT INTO test VALUES ('abcd')

statement error value too long for type character\(4\)
INSERT INTO test VALUES ('abcdef')

statement ok
INSERT INTO test VALUES ('áááá')

statement error value too long
INSERT INTO test VALUES ('ááááß')

statement ok
UPDATE test SET t = 'b' WHERE t = 'abcde'

statement error value too long
UPDATE test SET t = 'cdefg' WHERE t = 'ab'

# Not supported by Materialize.
onlyif cockroach
statement ok
CREATE TABLE tb (
  b BIT(3),
  UNIQUE INDEX a (b)
)

# Not supported by Materialize.
onlyif cockroach
statement ok
INSERT INTO tb VALUES (B'001')

# Not supported by Materialize.
onlyif cockroach
statement ok
INSERT INTO tb VALUES (B'011')

# Not supported by Materialize.
onlyif cockroach
statement ok
INSERT INTO tb VALUES (B'111')

statement error unknown catalog item 'tb'
INSERT INTO tb VALUES (B'1111')

# Not supported by Materialize.
onlyif cockroach
statement ok
UPDATE tb SET b = B'010' WHERE b = B'111'

statement error unknown catalog item 'tb'
UPDATE tb SET b = B'10000' WHERE b = B'010'

statement ok
CREATE TABLE tc (
  b INT2,
  UNIQUE INDEX a (b)
)

statement ok
INSERT INTO tc VALUES (50)

statement ok
INSERT INTO tc VALUES (-32768)

statement ok
INSERT INTO tc VALUES (32767)

# Note that neither of these value are INT2, but we only check
# on insert and update, not mathematical operations
statement ok
INSERT INTO tc VALUES (60000-59999)

statement error "\-32769" smallint out of range
INSERT INTO tc VALUES (-32769)

statement error "32768" smallint out of range
INSERT INTO tc VALUES (32768)

statement ok
UPDATE tc SET b = 80 WHERE b = 50

statement error "32768" smallint out of range
UPDATE tc SET b = 32768 WHERE b = 32767

statement ok
CREATE TABLE tc1 (
  b INT4,
  UNIQUE INDEX a (b)
)

statement ok
INSERT INTO tc1 VALUES (50)

statement ok
INSERT INTO tc1 VALUES (-2147483648)

statement ok
INSERT INTO tc1 VALUES (2147483647)

statement error "\-2147483649" integer out of range
INSERT INTO tc1 VALUES (-2147483649)

statement error "2147483648" integer out of range
INSERT INTO tc1 VALUES (2147483648)

statement ok
UPDATE tc1 SET b = 80 WHERE b = 50

statement error "2147483648" integer out of range
UPDATE tc1 SET b = 2147483648 WHERE b = 2147483647

statement ok
CREATE TABLE td (
  d DECIMAL(3, 2),
  UNIQUE INDEX b (d)
)

statement ok
INSERT INTO td VALUES (DECIMAL '3.1')

statement ok
INSERT INTO td VALUES (DECIMAL '3.14')

# Not supported by Materialize.
onlyif cockroach
statement error duplicate
INSERT INTO td VALUES (DECIMAL '3.1415')

# Not supported by Materialize.
onlyif cockroach
statement error type DECIMAL\(3,2\): value with precision 3, scale 2 must round to an absolute value less than 10\^1
INSERT INTO td VALUES (DECIMAL '13.1415')

query R rowsort
SELECT d FROM td
----
3.1
3.14

# Not supported by Materialize.
onlyif cockroach
statement error must round
UPDATE td SET d = DECIMAL '101.414' WHERE d = DECIMAL '3.14'

statement ok
UPDATE td SET d = DECIMAL '1.414' WHERE d = DECIMAL '3.14'

# Not supported by Materialize.
onlyif cockroach
statement error duplicate
UPDATE td SET d = DECIMAL '1.41' WHERE d = DECIMAL '3.1'

query R rowsort
SELECT d FROM td
----
1.41
3.1

statement ok
CREATE TABLE td2 (x DECIMAL(3), y DECIMAL)

statement ok
INSERT INTO td2 VALUES (DECIMAL '123.1415', DECIMAL '123.1415')

query RR
select x, y FROM td2
----
123.1415  123.1415


# Ensure decimal columns greater than 16 precision are supported.

statement ok
CREATE TABLE td3 (a decimal, b decimal(3, 1), c decimal(20, 10))

statement ok
INSERT INTO td3 VALUES (123456789012.123456789012, 12.3, 1234567890.1234567890)

query RRR
select * from td3
----
123456789012.123456789012  12.3  1234567890.123456789

# Not supported by Materialize.
onlyif cockroach
statement error must round
INSERT INTO td3 (c) VALUES (12345678901)
