# Copyright 2015 - 2023 The Cockroach Authors. All rights reserved.
# Copyright Materialize, Inc. and contributors. All rights reserved.
#
# Use of this software is governed by the Business Source License
# included in the LICENSE file at the root of this repository.
#
# As of the Change Date specified in that file, in accordance with
# the Business Source License, use of this software will be governed
# by the Apache License, Version 2.0.
#
# This file is derived from the logic test suite in CockroachDB. The
# original file was retrieved on July 6, 2026 from:
#
#     https://github.com/cockroachdb/cockroach/blob/358e0d87912365b8976c55ab9b3292e999cf720d/pkg/sql/logictest/testdata/logic_test/typing
#
# That commit is tagged v23.1.0. CockroachDB v23.1 is licensed under
# the Business Source License 1.1 with a Change Date of 2026-04-01 and
# a Change License of Apache 2.0, so as of the retrieval date the
# original source code is subject to the terms of the Apache 2.0
# license, a copy of which can be found in the LICENSE file at the
# root of this repository.

mode cockroach

statement ok
CREATE TABLE f (x FLOAT)

statement ok
INSERT INTO f(x) VALUES (3/2), (1)

query R rowsort
SELECT * FROM f
----
1
1

statement ok
CREATE TABLE i (x INT)

statement error column "x" is of type integer but expression is of type timestamp with time zone
INSERT INTO i(x) VALUES ('1970-01-01'::timestamptz)

statement ok
INSERT INTO i(x) VALUES (2.0)

statement error "9223372036854775809" integer out of range
INSERT INTO i(x) VALUES (9223372036854775809)

query I rowsort
SELECT * FROM i
----
2

statement ok
CREATE TABLE d (x DECIMAL)

statement ok
INSERT INTO d(x) VALUES (((9 / 3) * (1 / 3))), (2.0), (2.4 + 4.6)

query R rowsort
SELECT * FROM d
----
0
2
7

statement ok
UPDATE d SET x = x + 1 WHERE x + sqrt(x) >= 2 + .1

query R rowsort
SELECT * FROM d
----
0
3
8

statement ok
CREATE TABLE s (x STRING)

# Not supported by Materialize.
onlyif cockroach
query T
SELECT * FROM s WHERE x > b'\x00'
----

# Not supported by Materialize.
onlyif cockroach
statement ok
INSERT INTO s(x) VALUES (b'qwe'), ('start' || b'end')

# Not supported by Materialize.
onlyif cockroach
statement ok
INSERT INTO s(x) VALUES (b'\xfffefd')

query IT rowsort
SELECT length(x), encode(x::bytes, 'escape') from s
----


# Not supported by Materialize.
onlyif cockroach
statement error incompatible COALESCE expressions: could not parse "foo" as type int
INSERT INTO s VALUES (COALESCE(1, 'foo'))

# Not supported by Materialize.
onlyif cockroach
statement error incompatible COALESCE expressions: could not parse "foo" as type int
INSERT INTO i VALUES (COALESCE(1, 'foo'))

# Not supported by Materialize.
onlyif cockroach
query error incompatible COALESCE expressions: could not parse "foo" as type int
SELECT COALESCE(1, 'foo')

# Not supported by Materialize.
onlyif cockroach
query error incompatible COALESCE expressions: could not parse "foo" as type int
SELECT COALESCE(1::INT, 'foo')

# Not supported by Materialize.
onlyif cockroach
query error expected 2.3 to be of type int, found type decimal
SELECT greatest(-1, 1, 2.3, 123456789, 3 + 5, -(-4))

query I
SELECT greatest(-1, 1, 2, 123456789, 3 + 5, -(-4))
----
123456789

query T
SELECT greatest('2010-09-29', '2010-09-28'::TIMESTAMP)
----
2010-09-29 00:00:00

# Not supported by Materialize.
onlyif cockroach
query T
SELECT greatest('PT12H2M', 'PT12H2M'::INTERVAL, '1s')
----
12:02:00

query R
SELECT greatest(-1.123, 1.21313, 2.3, 123456789.321, 3 + 5.3213, -(-4.3213), abs(-9))
----
123456789.321

statement ok
CREATE TABLE untyped (b bool, n INT, f FLOAT, e DECIMAL, d DATE, ts TIMESTAMP, tz TIMESTAMPTZ, i INTERVAL)

# Not supported by Materialize.
onlyif cockroach
statement ok
INSERT INTO untyped VALUES ('f', '42', '4.2', '4.20', '2010-09-28', '2010-09-28 12:00:00.1', '2010-09-29 12:00:00.1', 'PT12H2M')

query BIRRTTTT
SELECT * FROM untyped
----


# Issue #14527: support string literal coercion during overload resolution
query T
SELECT ts FROM untyped WHERE ts != '2015-09-18 00:00:00'
----


# Regression tests for #15050

# Not supported by Materialize.
onlyif cockroach
statement error pq: parsing as type timestamp: could not parse "Not Timestamp"
CREATE TABLE t15050a (c DECIMAL DEFAULT CASE WHEN now() < 'Not Timestamp' THEN 2 ELSE 2 END);

statement error function "if" does not exist
CREATE TABLE t15050b (c DECIMAL DEFAULT IF(now() < 'Not Timestamp', 2, 2));

# Regression tests for #15632

statement error function "ifnull" does not exist
SELECT IFNULL('foo', false)

statement error function "ifnull" does not exist
SELECT IFNULL(true, 'foo')

# Not supported by Materialize.
onlyif cockroach
query B
SELECT IFNULL(false, 'true')
----
false

# Not supported by Materialize.
onlyif cockroach
query B
SELECT IFNULL('true', false)
----
true

# Regression tests for #19770

query B
SELECT 1 in (SELECT 1)
----
true

statement error operator does not exist: integer = text
SELECT 1 IN (SELECT 'a')

statement error operator does not exist: integer = record\(f1: integer,f2: integer\)
SELECT 1 IN (SELECT (1, 2))

query B
SELECT (1, 2) IN (SELECT 1, 2)
----
true

# Not supported by Materialize.
onlyif cockroach
query B
SELECT (1, 2) IN (SELECT (1, 2))
----
true

statement ok
CREATE TABLE t1 (a DATE)

statement ok
CREATE TABLE t2 (b TIMESTAMPTZ)

statement ok
INSERT INTO t1 VALUES (DATE '2018-01-01'); INSERT INTO t2 VALUES (TIMESTAMPTZ '2018-01-01');

# Make sure that we do not create invalid filters due to substituting columns
# with different types.
query TT
SELECT * FROM t1, t2 WHERE a = b AND age(b, TIMESTAMPTZ '2017-01-01') > INTERVAL '1 day'
----
2018-01-01  2018-01-01␠00:00:00+00

# Regression test for #44181: allow left side of BETWEEN to be typed
# differently in the two comparisons.
query B
SELECT '' BETWEEN ''::BYTES AND '';
----
true

# Not supported by Materialize.
onlyif cockroach
# Regression test for #44632: NULLIF should have the type of the first argument.
query I
SELECT NULLIF(NULL, 0) + NULLIF(NULL, 0)
----
NULL

query I
SELECT NULLIF(0, 0) + NULLIF(0, 0)
----
NULL

query I
SELECT NULLIF(0, NULL) + NULLIF(0, NULL)
----
0

# Regression test for #46196.
query T
SELECT max(t0.c0) FROM (VALUES (NULL), (NULL)) t0(c0)
----
NULL

query T
SELECT max(NULL) FROM (VALUES (NULL), (NULL)) t0(c0)
----
NULL

# Test qualified type references.
query IITR
SELECT 1::pg_catalog.int4, 1::pg_catalog.int8, 'aa'::pg_catalog.text, 4.2::pg_catalog.float4
----
1 1 aa 4.2

# Test fixed-length types.

# Not supported by Materialize.
onlyif cockroach
query TTT
SELECT VARCHAR(4) 'foo', CHAR(2) 'bar', STRING(1) 'cat'
----
foo  ba  c

# Test that we error out referencing unknown types in pg_catalog.
query error type "pg_catalog\.special_int" does not exist
SELECT 1::pg_catalog.special_int

# Test that we error out trying to reference types in schemas that
# don't have types.
query error unknown schema 'crdb_internal'
SELECT 1::crdb_internal.mytype

# Not supported by Materialize.
onlyif cockroach
# Regression test for #50978.
query T
SELECT CASE WHEN true THEN 1234:::OID ELSE COALESCE(NULL, NULL) END
----
1234

# Regression test for #51099.
query B rowsort
SELECT CASE WHEN x > 1 THEN true ELSE NULL AND true END FROM (VALUES (1), (2)) AS v(x)
----
NULL
true

query B rowsort
SELECT CASE WHEN x > 1 THEN true ELSE NULL OR false END FROM (VALUES (1), (2)) AS v(x)
----
NULL
true

# Error "cannot determine type of empty array" should apply no matter the
# operator, `>`, or `<`.
query error SOME requires a single expression or subquery, not an expression list
SELECT ARRAY[]::TIMESTAMPTZ[] >
       SOME (ARRAY[TIMESTAMPTZ '1969-12-29T21:20:13+01'], ARRAY[NULL]);

# Error "cannot determine type of empty array" should apply no matter the
# operator, `>`, or `<`.
query error SOME requires a single expression or subquery, not an expression list
SELECT ARRAY[]::TIMESTAMPTZ[] <
       SOME (ARRAY[TIMESTAMPTZ '1969-12-29T21:20:13+01'], ARRAY[NULL]);
