# Copyright Materialize, Inc. and contributors. All rights reserved.
#
# Use of this software is governed by the Business Source License
# included in the LICENSE file at the root of this repository.
#
# As of the Change Date specified in that file, in accordance with
# the Business Source License, use of this software will be governed
# by the Apache License, Version 2.0.

mode cockroach

statement ok
CREATE TABLE a(a INTEGER);

statement ok
CREATE TABLE b(b INTEGER);

statement ok
CREATE TABLE c(c INTEGER);

statement ok
INSERT INTO a VALUES (1);

statement ok
INSERT INTO b VALUES (2);

statement ok
INSERT INTO c VALUES (3);

query III rowsort
SELECT * FROM a, b full join c on b = c;
----
1  NULL  3
1  2  NULL

query III
SELECT * FROM a, b right join c on b = c;
----
1  NULL  3

query III
SELECT * FROM a, b left join c on b = c;
----
1  2  NULL

query III
SELECT * FROM a CROSS JOIN b JOIN LATERAL(SELECT a.a FROM c) x ON TRUE;
----
1 2 1

query III
SELECT * FROM a, b FULL JOIN LATERAL(SELECT a.a FROM c) x ON TRUE;
----
1 2 1

query III
SELECT * FROM a CROSS JOIN (b FULL JOIN LATERAL(SELECT a.a FROM c) x ON TRUE);
----
1 2 1

statement ok
CREATE TABLE t1 (a int, b int);

statement ok
CREATE TABLE t2 (a int, c int);

statement ok
INSERT INTO t1 VALUES (1, 2), (2, 3);

statement ok
INSERT INTO t2 VALUES (2, 4), (5, 7);

query IIII rowsort
SELECT * FROM generate_series(1, 2), LATERAL (SELECT * FROM t1) _ NATURAL RIGHT JOIN t2;
----
1 2 3    4
2 2 3    4
1 5 NULL 7
2 5 NULL 7

statement ok
create table left(x int, y int);

statement ok
create table right1(x int, y int);

statement ok
create view right1_keyed(x, y) as select distinct on(x) * from right1;

statement ok
create table right2(x int, y int);

statement ok
insert into left values (0,0);

statement ok
insert into right2 values (0,0);

# `consolidate_output` should be true when there is a negated input to a Union.
query T multiline
EXPLAIN PHYSICAL PLAN AS VERBOSE TEXT FOR
select *
from
  left
  LEFT JOIN right1_keyed ON left.x = right1_keyed.x
  LEFT JOIN right2 ON left.x = right2.x;
----
Explained Query:
  With
    cte l0 =
      TopK::MonotonicTop1 group_by=[#0] must_consolidate
        Get::Collection materialize.public.right1
          raw=true
    cte l1 =
      Reduce::Distinct
        key_plan=id
        val_plan
          project=()
        Union
          Get::Collection materialize.public.left
            project=(#0)
            raw=true
          Constant
            - (null)
  Return
    Join::Delta
      plan_path[0]
        delta_stage[1]
          closure
            project=(#0..=#3, #7, #8)
            map=((#5) IS NULL, case when #6 then null else #0 end, case when #6 then null else #4 end)
          lookup={ relation=2, key=[#0] }
          stream={ key=[#0], thinning=(#1..=#3) }
        delta_stage[0]
          closure
            project=(#0, #1, #5, #6)
            map=((#3) IS NULL, case when #4 then null else #0 end, case when #4 then null else #2 end)
          lookup={ relation=1, key=[#0] }
          stream={ key=[#0], thinning=(#1) }
        source={ relation=0, key=[#0] }
      plan_path[1]
        delta_stage[1]
          closure
            project=(#1, #2, #4, #3, #8, #9)
            map=((#6) IS NULL, case when #7 then null else #1 end, case when #7 then null else #5 end)
          lookup={ relation=2, key=[#0] }
          stream={ key=[#2], thinning=(#0, #1, #3, #4) }
        delta_stage[0]
          closure
            project=(#0, #3, #0, #2, #4)
            map=(case when #1 then null else #0 end)
          lookup={ relation=0, key=[#0] }
          stream={ key=[#0], thinning=(#1, #2) }
        initial_closure
          project=(#0, #3, #4)
          map=((#2) IS NULL, case when #3 then null else #1 end)
        source={ relation=1, key=[#0] }
      plan_path[2]
        delta_stage[1]
          closure
            project=(#1, #2, #8, #9, #4, #3)
            map=((#6) IS NULL, case when #7 then null else #1 end, case when #7 then null else #5 end)
          lookup={ relation=1, key=[#0] }
          stream={ key=[#2], thinning=(#0, #1, #3, #4) }
        delta_stage[0]
          closure
            project=(#0, #3, #0, #2, #4)
            map=(case when #1 then null else #0 end)
          lookup={ relation=0, key=[#0] }
          stream={ key=[#0], thinning=(#1, #2) }
        initial_closure
          project=(#0, #3, #4)
          map=((#2) IS NULL, case when #3 then null else #1 end)
        source={ relation=2, key=[#0] }
      ArrangeBy
        raw=true
        arrangements[0]={ key=[#0], permutation=id, thinning=(#1) }
        Get::PassArrangements materialize.public.left
          raw=true
      ArrangeBy
        raw=true
        arrangements[0]={ key=[#0], permutation=id, thinning=(#1, #2) }
        Union
          Get::Arrangement l0
            project=(#0..=#2)
            map=(true)
            key=#0
            raw=false
            arrangements[0]={ key=[#0], permutation=id, thinning=(#1) }
          Mfp
            project=(#0..=#2)
            map=(null, null)
            input_key=#0
            SetDifference ensure_arrangement={ key=[#0], permutation=id, thinning=() } base_key=[#0] subtract_key=[#0]
              ArrangeBy
                input_key=[#0]
                raw=true
                Get::PassArrangements l1
                  raw=false
                  arrangements[0]={ key=[#0], permutation=id, thinning=() }
              Get::PassArrangements l0
                raw=false
                arrangements[0]={ key=[#0], permutation=id, thinning=(#1) }
      ArrangeBy
        raw=true
        arrangements[0]={ key=[#0], permutation=id, thinning=(#1, #2) }
        Union
          Get::Collection materialize.public.right2
            project=(#0..=#2)
            map=(true)
            raw=true
          Mfp
            project=(#0..=#2)
            map=(null, null)
            input_key=#0
            Threshold::Basic ensure_arrangement={ key=[#0], permutation=id, thinning=() }
              ArrangeBy
                raw=false
                arrangements[0]={ key=[#0], permutation=id, thinning=() }
                Union consolidate_output=true
                  Negate
                    Get::Collection materialize.public.right2
                      project=(#0)
                      raw=true
                  ArrangeBy
                    input_key=[#0]
                    raw=true
                    Get::PassArrangements l1
                      raw=false
                      arrangements[0]={ key=[#0], permutation=id, thinning=() }

Source materialize.public.left
Source materialize.public.right1
  filter=((#0) IS NOT NULL)
Source materialize.public.right2
  filter=((#0) IS NOT NULL)

Target cluster: quickstart

EOF

query IIIIII
select *
from
  left
  LEFT JOIN right1_keyed ON left.x = right1_keyed.x
  LEFT JOIN right2 ON left.x = right2.x;
----
0  0  NULL  NULL  0  0

# Fused set-difference recognizer (CLU-168).
#
# The recognizer rewrites the co-arranged anti-side shape
# `Threshold::Basic(ArrangeBy(Union(base, Negate(subtract))))` into a single
# `SetDifference` node. It is gated behind `enable_fused_set_difference` and
# dormant while the flag is off.

statement ok
CREATE TABLE sd_base(k INT)

statement ok
CREATE TABLE sd_sub(k INT)

# Baseline with the flag OFF: the plan retains `Threshold::Basic` over `Union`.
query T multiline
EXPLAIN PHYSICAL PLAN AS VERBOSE TEXT FOR
  SELECT k FROM sd_base EXCEPT SELECT k FROM sd_sub
----
Explained Query:
  SetDifference ensure_arrangement={ key=[#0], permutation=id, thinning=() } base_key=[#0] subtract_key=[#0]
    ArrangeBy
      input_key=[#0]
      raw=true
      Reduce::Distinct
        key_plan=id
        val_plan
          project=()
        Get::PassArrangements materialize.public.sd_base
          raw=true
    ArrangeBy
      input_key=[#0]
      raw=true
      Reduce::Distinct
        key_plan=id
        val_plan
          project=()
        Get::PassArrangements materialize.public.sd_sub
          raw=true

Source materialize.public.sd_base
Source materialize.public.sd_sub

Target cluster: quickstart

EOF

simple conn=mz_system,user=mz_system
ALTER SYSTEM SET enable_fused_set_difference = on
----
COMPLETE 0

# With the flag ON the same shape collapses into a `SetDifference` node.
query T multiline
EXPLAIN PHYSICAL PLAN AS VERBOSE TEXT FOR
  SELECT k FROM sd_base EXCEPT SELECT k FROM sd_sub
----
Explained Query:
  SetDifference ensure_arrangement={ key=[#0], permutation=id, thinning=() } base_key=[#0] subtract_key=[#0]
    ArrangeBy
      input_key=[#0]
      raw=true
      Reduce::Distinct
        key_plan=id
        val_plan
          project=()
        Get::PassArrangements materialize.public.sd_base
          raw=true
    ArrangeBy
      input_key=[#0]
      raw=true
      Reduce::Distinct
        key_plan=id
        val_plan
          project=()
        Get::PassArrangements materialize.public.sd_sub
          raw=true

Source materialize.public.sd_base
Source materialize.public.sd_sub

Target cluster: quickstart

EOF

# The recognizer fires inside a `LetRec` (a recursive CTE) too. `c`'s recursive definition
# below is an anti-side shape (`sd_base EXCEPT c`) and the trailing `EXCEPT sd_sub` in the
# body is a second one; both fuse, since the walk descends into the `LetRec`'s `values` and
# `body` and each arm is arranged. The fused operator handles the partial-order timestamps a
# recursive scope introduces (its iteration coordinate) with the same interesting-time
# synthesis it uses for any partial order. Fusion still requires arranged arms: a subtrahend
# that is a bare already-distinct recursive reference renders raw and does not fuse.
query T multiline
EXPLAIN PHYSICAL PLAN AS VERBOSE TEXT FOR
WITH MUTUALLY RECURSIVE
  c (k INT) AS (
    SELECT k FROM sd_base
    EXCEPT
    SELECT k FROM c
  )
SELECT * FROM c
EXCEPT
SELECT k FROM sd_sub
----
Explained Query:
  With Mutually Recursive
    cte l0 =
      ArrangeBy
        input_key=[#0]
        raw=true
        SetDifference ensure_arrangement={ key=[#0], permutation=id, thinning=() } base_key=[#0] subtract_key=[#0]
          ArrangeBy
            input_key=[#0]
            raw=true
            Reduce::Distinct
              key_plan=id
              val_plan
                project=()
              Get::PassArrangements materialize.public.sd_base
                raw=true
          ArrangeBy
            input_key=[#0]
            raw=true
            Reduce::Distinct
              key_plan=id
              val_plan
                project=()
              Get::PassArrangements l0
                raw=true
  Return
    SetDifference ensure_arrangement={ key=[#0], permutation=id, thinning=() } base_key=[#0] subtract_key=[#0]
      ArrangeBy
        input_key=[#0]
        raw=true
        Reduce::Distinct
          key_plan=id
          val_plan
            project=()
          Get::PassArrangements l0
            raw=true
      ArrangeBy
        input_key=[#0]
        raw=true
        Reduce::Distinct
          key_plan=id
          val_plan
            project=()
          Get::PassArrangements materialize.public.sd_sub
            raw=true

Source materialize.public.sd_base
Source materialize.public.sd_sub

Target cluster: quickstart

EOF

# The recognizer also fires on the LEFT JOIN anti-branches, the riskiest positive shape:
# the two arms have heterogeneous thinning (`l0` thinning=(#1), `l1` thinning=()) and one
# arm is a `Get` advertising its arrangement directly while the other reads through an
# `ArrangeBy`'s `input_key`. Both anti-branches collapse to `SetDifference`.
#
# The `subtract` arm reads `l0` as `Get::PassArrangements` (not a projecting `Get::Arrangement`).
# The recognizer strips the projection so the operator consumes `l0`'s existing arrangement
# directly, keyed `[#0]` (`subtract_key`), instead of re-arranging a projected raw collection.
# That is the outer-join memory win: no per-arm `ArrangeBy` is reintroduced under the fused node.
query T multiline
EXPLAIN PHYSICAL PLAN AS VERBOSE TEXT FOR
select *
from
  left
  LEFT JOIN right1_keyed ON left.x = right1_keyed.x
  LEFT JOIN right2 ON left.x = right2.x;
----
Explained Query:
  With
    cte l0 =
      TopK::MonotonicTop1 group_by=[#0] must_consolidate
        Get::Collection materialize.public.right1
          raw=true
    cte l1 =
      Reduce::Distinct
        key_plan=id
        val_plan
          project=()
        Union
          Get::Collection materialize.public.left
            project=(#0)
            raw=true
          Constant
            - (null)
  Return
    Join::Delta
      plan_path[0]
        delta_stage[1]
          closure
            project=(#0..=#3, #7, #8)
            map=((#5) IS NULL, case when #6 then null else #0 end, case when #6 then null else #4 end)
          lookup={ relation=2, key=[#0] }
          stream={ key=[#0], thinning=(#1..=#3) }
        delta_stage[0]
          closure
            project=(#0, #1, #5, #6)
            map=((#3) IS NULL, case when #4 then null else #0 end, case when #4 then null else #2 end)
          lookup={ relation=1, key=[#0] }
          stream={ key=[#0], thinning=(#1) }
        source={ relation=0, key=[#0] }
      plan_path[1]
        delta_stage[1]
          closure
            project=(#1, #2, #4, #3, #8, #9)
            map=((#6) IS NULL, case when #7 then null else #1 end, case when #7 then null else #5 end)
          lookup={ relation=2, key=[#0] }
          stream={ key=[#2], thinning=(#0, #1, #3, #4) }
        delta_stage[0]
          closure
            project=(#0, #3, #0, #2, #4)
            map=(case when #1 then null else #0 end)
          lookup={ relation=0, key=[#0] }
          stream={ key=[#0], thinning=(#1, #2) }
        initial_closure
          project=(#0, #3, #4)
          map=((#2) IS NULL, case when #3 then null else #1 end)
        source={ relation=1, key=[#0] }
      plan_path[2]
        delta_stage[1]
          closure
            project=(#1, #2, #8, #9, #4, #3)
            map=((#6) IS NULL, case when #7 then null else #1 end, case when #7 then null else #5 end)
          lookup={ relation=1, key=[#0] }
          stream={ key=[#2], thinning=(#0, #1, #3, #4) }
        delta_stage[0]
          closure
            project=(#0, #3, #0, #2, #4)
            map=(case when #1 then null else #0 end)
          lookup={ relation=0, key=[#0] }
          stream={ key=[#0], thinning=(#1, #2) }
        initial_closure
          project=(#0, #3, #4)
          map=((#2) IS NULL, case when #3 then null else #1 end)
        source={ relation=2, key=[#0] }
      ArrangeBy
        raw=true
        arrangements[0]={ key=[#0], permutation=id, thinning=(#1) }
        Get::PassArrangements materialize.public.left
          raw=true
      ArrangeBy
        raw=true
        arrangements[0]={ key=[#0], permutation=id, thinning=(#1, #2) }
        Union
          Get::Arrangement l0
            project=(#0..=#2)
            map=(true)
            key=#0
            raw=false
            arrangements[0]={ key=[#0], permutation=id, thinning=(#1) }
          Mfp
            project=(#0..=#2)
            map=(null, null)
            input_key=#0
            SetDifference ensure_arrangement={ key=[#0], permutation=id, thinning=() } base_key=[#0] subtract_key=[#0]
              ArrangeBy
                input_key=[#0]
                raw=true
                Get::PassArrangements l1
                  raw=false
                  arrangements[0]={ key=[#0], permutation=id, thinning=() }
              Get::PassArrangements l0
                raw=false
                arrangements[0]={ key=[#0], permutation=id, thinning=(#1) }
      ArrangeBy
        raw=true
        arrangements[0]={ key=[#0], permutation=id, thinning=(#1, #2) }
        Union
          Get::Collection materialize.public.right2
            project=(#0..=#2)
            map=(true)
            raw=true
          Mfp
            project=(#0..=#2)
            map=(null, null)
            input_key=#0
            Threshold::Basic ensure_arrangement={ key=[#0], permutation=id, thinning=() }
              ArrangeBy
                raw=false
                arrangements[0]={ key=[#0], permutation=id, thinning=() }
                Union consolidate_output=true
                  Negate
                    Get::Collection materialize.public.right2
                      project=(#0)
                      raw=true
                  ArrangeBy
                    input_key=[#0]
                    raw=true
                    Get::PassArrangements l1
                      raw=false
                      arrangements[0]={ key=[#0], permutation=id, thinning=() }

Source materialize.public.left
Source materialize.public.right1
  filter=((#0) IS NOT NULL)
Source materialize.public.right2
  filter=((#0) IS NOT NULL)

Target cluster: quickstart

EOF

# Negative case 1: `EXCEPT ALL` produces the same `Threshold::Basic`/`Union` anti-side
# shape, but its arms are raw (not arranged on the difference key), so the recognizer
# declines on the co-arrangement guard and leaves the plan unchanged.
query T multiline
EXPLAIN PHYSICAL PLAN AS VERBOSE TEXT FOR
  SELECT k FROM sd_base EXCEPT ALL SELECT k FROM sd_sub
----
Explained Query:
  Threshold::Basic ensure_arrangement={ key=[#0], permutation=id, thinning=() }
    ArrangeBy
      raw=false
      arrangements[0]={ key=[#0], permutation=id, thinning=() }
      Union consolidate_output=true
        Get::PassArrangements materialize.public.sd_base
          raw=true
        Negate
          Get::PassArrangements materialize.public.sd_sub
            raw=true

Source materialize.public.sd_base
Source materialize.public.sd_sub

Target cluster: quickstart

EOF

# Indexes make both `EXCEPT ALL` arms available arranged on the difference key.
statement ok
CREATE INDEX sd_base_idx ON sd_base(k)

statement ok
CREATE INDEX sd_sub_idx ON sd_sub(k)

# Negative case 2: both arms are now arranged on the key, but the anti-side arm reads its
# arrangement through a residual filter (`k > 5`), a non-projection MFP. The recognizer
# declines because the MFP between the arm and its arrangement does more than project.
query T multiline
EXPLAIN PHYSICAL PLAN AS VERBOSE TEXT FOR
  SELECT k FROM sd_base EXCEPT ALL (SELECT k FROM sd_sub WHERE k > 5)
----
Explained Query:
  Threshold::Basic ensure_arrangement={ key=[#0], permutation=id, thinning=() }
    ArrangeBy
      raw=false
      arrangements[0]={ key=[#0], permutation=id, thinning=() }
      Union consolidate_output=true
        ArrangeBy
          input_key=[#0{k}]
          raw=true
          Get::PassArrangements materialize.public.sd_base
            raw=false
            arrangements[0]={ key=[#0{k}], permutation=id, thinning=() }
        Negate
          Get::Arrangement materialize.public.sd_sub
            filter=((#0{k} > 5))
            key=#0{k}
            raw=false
            arrangements[0]={ key=[#0{k}], permutation=id, thinning=() }

Used Indexes:
  - materialize.public.sd_base_idx (*** full scan ***)
  - materialize.public.sd_sub_idx (*** full scan ***)

Target cluster: quickstart

EOF
simple conn=mz_system,user=mz_system
ALTER SYSTEM SET enable_fused_set_difference = off
----
COMPLETE 0

# Result equivalence for the fused SetDifference recognizer (CLU-168, Task 5).
#
# The EXPLAIN goldens above prove the recognizer fires on these two shapes
# when `enable_fused_set_difference` is on. This section proves the rewrite
# is behavior-preserving: the same queries return the same rows whether the
# flag is on or off.

# EXCEPT case. sd_base gets {1, 1, 2, 3} (a duplicate to exercise dedup),
# sd_sub gets {2, 3, 4}. sd_base minus sd_sub, deduplicated, is {1}.
statement ok
INSERT INTO sd_base VALUES (1), (1), (2), (3)

statement ok
INSERT INTO sd_sub VALUES (2), (3), (4)

# Flag OFF (the default): baseline result.
query I
SELECT k FROM sd_base EXCEPT SELECT k FROM sd_sub;
----
1

simple conn=mz_system,user=mz_system
ALTER SYSTEM SET enable_fused_set_difference = on
----
COMPLETE 0

# Flag ON: same result. The physical plan for this exact query now uses
# `SetDifference` (see the EXPLAIN golden earlier in this file).
query I
SELECT k FROM sd_base EXCEPT SELECT k FROM sd_sub;
----
1

# LEFT JOIN anti-side case. Extend the `left`/`right1`/`right2` fixture with
# rows that exercise both a match and a miss on each anti-branch:
#   x=0: no right1 row (anti-side NULL fill), matches right2.
#   x=1: matches right1 (via right1_keyed), no right2 row (anti-side NULL fill).
#   x=2: no right1 row (anti-side NULL fill), matches right2's new row.
statement ok
INSERT INTO left VALUES (1, 10), (2, 20)

statement ok
INSERT INTO right1 VALUES (1, 100)

statement ok
INSERT INTO right2 VALUES (2, 200)

# Flag is still ON from above. Hand-verified per the join semantics noted above.
query IIIIII rowsort
select *
from
  left
  LEFT JOIN right1_keyed ON left.x = right1_keyed.x
  LEFT JOIN right2 ON left.x = right2.x;
----
0  0   NULL  NULL  0  0
1  10  1     100   NULL  NULL
2  20  NULL  NULL  2  200

simple conn=mz_system,user=mz_system
ALTER SYSTEM SET enable_fused_set_difference = off
----
COMPLETE 0

# Flag OFF mirror: same rows, recognizer dormant.
query IIIIII rowsort
select *
from
  left
  LEFT JOIN right1_keyed ON left.x = right1_keyed.x
  LEFT JOIN right2 ON left.x = right2.x;
----
0  0   NULL  NULL  0  0
1  10  1     100   NULL  NULL
2  20  NULL  NULL  2  200

# Incremental / maintained correctness for the fused SetDifference operator
# (CLU-168, Phase 2). The blocks above are one-shot peeks; the risky part of the
# fused operator is incremental maintenance: retractions, key reappearance, and
# frontier advancement across many commits. These blocks build maintained
# dataflows (materialized views) whose anti-side is recognized as SetDifference
# (flag ON), then drive several rounds of INSERT/DELETE with a result check after
# each round. Every expected result is hand-verified against the true
# set-difference semantics. Phase 1 (reconstructed Threshold) and Phase 2 (fused
# operator) must both pass identically: this is the differential oracle.

simple conn=mz_system,user=mz_system
ALTER SYSTEM SET enable_fused_set_difference = on
----
COMPLETE 0

statement ok
CREATE TABLE inc_base(k INT)

statement ok
CREATE TABLE inc_sub(k INT)

# Maintained distinct set-difference: distinct(inc_base) EXCEPT distinct(inc_sub).
# The Reduce::Distinct arms are co-arranged on the key, so the anti-side is
# rewritten to SetDifference and this MV's dataflow runs the fused operator.
statement ok
CREATE MATERIALIZED VIEW inc_diff AS
  SELECT k FROM inc_base EXCEPT SELECT k FROM inc_sub

# Round 1: base = {1,2,2,3} (a duplicate 2 to exercise per-key multiplicity
# collapsing in the distinct arm), sub = {}. diff = distinct(base) = {1,2,3}.
statement ok
INSERT INTO inc_base VALUES (1), (2), (2), (3)

query I rowsort
SELECT k FROM inc_diff
----
1
2
3

# Round 2: sub += {2}. Key 2 now cancels: net(2) = 1 - 1 = 0 -> retraction of 2.
statement ok
INSERT INTO inc_sub VALUES (2)

query I rowsort
SELECT k FROM inc_diff
----
1
3

# Round 3: sub += {1,3}. Everything cancels -> diff empty (two more retractions).
statement ok
INSERT INTO inc_sub VALUES (1), (3)

query I rowsort
SELECT k FROM inc_diff
----

# Round 4: DELETE the sub row for k=2. Key 2 reappears (net 0 -> 1): an insertion
# after a full retraction, the classic reduce revisit case.
statement ok
DELETE FROM inc_sub WHERE k = 2

query I rowsort
SELECT k FROM inc_diff
----
2

# Round 5: add key 4 to both base and sub in the same logical time. net(4)=0, so
# 4 never appears; diff unchanged at {2}. Exercises a net-zero key touched in both
# inputs' incoming batches.
statement ok
INSERT INTO inc_base VALUES (4)

statement ok
INSERT INTO inc_sub VALUES (4)

query I rowsort
SELECT k FROM inc_diff
----
2

# Round 6: DELETE the sub row for k=4. Key 4 reappears -> diff {2,4}.
statement ok
DELETE FROM inc_sub WHERE k = 4

query I rowsort
SELECT k FROM inc_diff
----
2
4

# Round 7: DELETE all base rows for k=2 (both duplicates). Key 2 drops from the
# distinct base -> net(2) = 0 -> retraction. diff {4}.
statement ok
DELETE FROM inc_base WHERE k = 2

query I rowsort
SELECT k FROM inc_diff
----
4

# Round 8: DELETE base rows for k=4. diff empty again (base and sub both back to
# {1,3}). Final retraction.
statement ok
DELETE FROM inc_base WHERE k = 4

query I rowsort
SELECT k FROM inc_diff
----

# Maintained multiset set-difference: inc2_base EXCEPT ALL inc2_sub, over indexed
# inputs. EXCEPT ALL keeps residual multiplicity max(count_base - count_sub, 0),
# so this exercises the operator's per-key net accounting for net > 1 and the
# summing of diffs over multiple records per key (the distinct arms above always
# collapse to a single record per key).
statement ok
CREATE TABLE inc2_base(k INT)

statement ok
CREATE TABLE inc2_sub(k INT)

statement ok
CREATE INDEX inc2_base_idx ON inc2_base(k)

statement ok
CREATE INDEX inc2_sub_idx ON inc2_sub(k)

statement ok
CREATE MATERIALIZED VIEW inc2_diff AS
  SELECT k FROM inc2_base EXCEPT ALL SELECT k FROM inc2_sub

# Round 1: base has three 5's, sub has one 5. net(5) = 3 - 1 = 2 -> two 5's.
statement ok
INSERT INTO inc2_base VALUES (5), (5), (5)

statement ok
INSERT INTO inc2_sub VALUES (5)

query I rowsort
SELECT k FROM inc2_diff
----
5
5

# Round 2: sub += two more 5's. net(5) = 3 - 3 = 0 -> empty (multiplicity to zero).
statement ok
INSERT INTO inc2_sub VALUES (5), (5)

query I rowsort
SELECT k FROM inc2_diff
----

# Round 3: base += one 5. net(5) = 4 - 3 = 1 -> one 5.
statement ok
INSERT INTO inc2_base VALUES (5)

query I rowsort
SELECT k FROM inc2_diff
----
5

# Round 4: DELETE all sub rows for k=5 (three of them). net(5) = 4 - 0 = 4.
statement ok
DELETE FROM inc2_sub WHERE k = 5

query I rowsort
SELECT k FROM inc2_diff
----
5
5
5
5

# Round 5: DELETE all base rows for k=5. net(5) = 0 -> empty.
statement ok
DELETE FROM inc2_base WHERE k = 5

query I rowsort
SELECT k FROM inc2_diff
----

simple conn=mz_system,user=mz_system
ALTER SYSTEM SET enable_fused_set_difference = off
----
COMPLETE 0
