# Copyright Materialize, Inc. and contributors. All rights reserved.
#
# Use of this software is governed by the Business Source License
# included in the LICENSE file at the root of this repository.
#
# As of the Change Date specified in that file, in accordance with
# the Business Source License, use of this software will be governed
# by the Apache License, Version 2.0.

# This test may seem simple, but it is surprisingly good at verifying that
# logical timestamp handling for internal inputs is sane.

statement ok
CREATE TABLE t (a INT)

statement ok
INSERT INTO t VALUES (1)

query I rowsort
SELECT a FROM t
----
1

statement ok
INSERT INTO t VALUES (2)

query I rowsort
SELECT a FROM t
----
1
2

statement ok
CREATE TABLE t2 (a INT)

statement ok
INSERT INTO t2 VALUES (1), (3)

query I
SELECT a FROM t NATURAL JOIN t2
----
1

statement ok
INSERT INTO t VALUES (3)

query I rowsort
SELECT a FROM t NATURAL JOIN t2
----
1
3

# Test that updates work in Serializable mode

statement ok
CREATE TABLE t1( x INTEGER)

statement ok
SET transaction_isolation=serializable

statement ok
INSERT INTO t1 VALUES(1)

statement ok
CREATE INDEX t1i1 ON t1(x)

statement ok
UPDATE t1 SET x=1

statement ok
UPDATE t1 SET x=2

statement ok
UPDATE t1 SET x=3

statement ok
UPDATE t1 SET x=4

statement ok
SET transaction_isolation='strict serializable'

query I
SELECT * FROM t1
----
4

# Test UPDATE AS

statement ok
UPDATE t1 AS m SET x = 5 WHERE m.x < 10

query I
SELECT * FROM t1
----
5

statement ok
UPDATE t1 AS m SET x = 6 WHERE x < 10

query I
SELECT * FROM t1
----
6

statement error db error: ERROR: column "t1\.x" does not exist
UPDATE t1 AS m SET x = 5 WHERE t1.x < 10
